{
  "template": "canvas2d_roguelike",
  "title": "Depths of Varrow",
  "tile_size": 32,
  "theme": {
    "wall_color": "#403a2e",
    "floor_color": "#15131f",
    "accent_color": "#7c5cfa",
    "hud_color": "#f4f0ff",
    "exit_color": "#4ade80",
    "treasure_color": "#ffd24a"
  },
  "map": [
    "###############",
    "#.............#",
    "#...#..#..#...#",
    "#.............#",
    "#...#....#....#",
    "#.............#",
    "#.#......#..#.#",
    "#.............#",
    "#.....#..#....#",
    "#.............#",
    "###############"
  ],
  "player_spawn": { "col": 1, "row": 1 },
  "exit": { "col": 13, "row": 1 },
  "exit_requires_all_treasure": false,
  "player": { "max_hp": 20, "attack": 5, "color": "#7c5cfa" },
  "treasure": [
    { "col": 8, "row": 1, "value": 150 },
    { "col": 1, "row": 9, "value": 100 }
  ],
  "potions": [
    { "col": 6, "row": 5, "heal": 8 }
  ],
  "keys": [
    { "id": "iron", "col": 13, "row": 7, "color": "#c0c0d0" }
  ],
  "doors": [
    { "key_id": "iron", "col": 5, "row": 3, "color": "#8a5a2e" }
  ],
  "enemies": [
    { "id": "rat", "name": "a giant rat", "col": 7, "row": 7, "hp": 6, "damage": 2, "score": 40, "behavior": "wander", "color": "#a08060" },
    { "id": "goblin", "name": "a goblin", "col": 11, "row": 5, "hp": 10, "damage": 3, "score": 80, "behavior": "chase", "sight": 6, "color": "#5ac86a" },
    { "id": "wraith", "name": "a wraith", "col": 3, "row": 9, "hp": 8, "damage": 4, "score": 100, "behavior": "chase", "sight": 5, "color": "#b39cff" }
  ],
  "assets": { "base_path": "assets/", "sprites": {} }
}
